=== START OF INFORMATION SECTION ===
Model Family:     Toshiba 2.5" HDD MQ01ABD...
Device Model:     TOSHIBA MQ01ABD100
Serial Number:    --
LU WWN Device Id: 5 000039 ...
Firmware Version: AX0R2J
User Capacity:    1 000 204 886 016 bytes [1,00 TB]
Sector Sizes:     512 bytes logical, 4096 bytes physical
Rotation Rate:    5400 rpm
Form Factor:      2.5 inches
Device is:        In smartctl database [for details use: -P show]
ATA Version is:   ATA8-ACS (minor revision not indicated)
SATA Version is:  SATA 3.0, 6.0 Gb/s (current: 6.0 Gb/s)
Local Time is:    Sat Oct  7 19:51:32 2017 +05
SMART support is: Available - device has SMART capability.
SMART support is: Enabled
AAM feature is:   Unavailable
APM level is:     128 (minimum power consumption without standby)
Rd look-ahead is: Enabled
Write cache is:   Enabled
ATA Security is:  Disabled, NOT FROZEN [SEC1]
Wt Cache Reorder: Enabled

=== START OF READ SMART DATA SECTION ===
SMART overall-health self-assessment test result: PASSED

General SMART Values:
Offline data collection status:  (0x80)	Offline data collection activity
					was never started.
					Auto Offline Data Collection: Enabled.
Self-test execution status:      (  22)	The self-test routine was aborted by
					the host.
Total time to complete Offline 
data collection: 		(  120) seconds.
Offline data collection
capabilities: 			 (0x5b) SMART execute Offline immediate.
					Auto Offline data collection on/off support.
					Suspend Offline collection upon new
					command.
					Offline surface scan supported.
					Self-test supported.
					No Conveyance Self-test supported.
					Selective Self-test supported.
SMART capabilities:            (0x0003)	Saves SMART data before entering
					power-saving mode.
					Supports SMART auto save timer.
Error logging capability:        (0x01)	Error logging supported.
					General Purpose Logging supported.
Short self-test routine 
recommended polling time: 	 (   2) minutes.
Extended self-test routine
recommended polling time: 	 ( 240) minutes.
SCT capabilities: 	       (0x003d)	SCT Status supported.
					SCT Error Recovery Control supported.
					SCT Feature Control supported.
					SCT Data Table supported.

SMART Attributes Data Structure revision number: 16
Vendor Specific SMART Attributes with Thresholds:
ID# ATTRIBUTE_NAME          FLAGS    VALUE WORST THRESH FAIL RAW_VALUE
  1 Raw_Read_Error_Rate     PO-R--   100   100   050    -    0
  2 Throughput_Performance  P-S---   100   100   050    -    0
  3 Spin_Up_Time            POS--K   100   100   001    -    1739
  4 Start_Stop_Count        -O--CK   100   100   000    -    2521
  5 Reallocated_Sector_Ct   PO--CK   100   100   050    -    0
  7 Seek_Error_Rate         PO-R--   100   100   050    -    0
  8 Seek_Time_Performance   P-S---   100   100   050    -    0
  9 Power_On_Hours          -O--CK   089   089   000    -    4753
 10 Spin_Retry_Count        PO--CK   149   100   030    -    0
 12 Power_Cycle_Count       -O--CK   100   100   000    -    2514
191 G-Sense_Error_Rate      -O--CK   100   100   000    -    55
192 Power-Off_Retract_Count -O--CK   100   100   000    -    121
193 Load_Cycle_Count        -O--CK   098   098   000    -    23514
194 Temperature_Celsius     -O---K   100   100   000    -    36 (Min/Max 19/50)
196 Reallocated_Event_Count -O--CK   100   100   000    -    0
197 Current_Pending_Sector  -O--CK   100   100   000    -    0
198 Offline_Uncorrectable   ----CK   100   100   000    -    0
199 UDMA_CRC_Error_Count    -O--CK   200   200   000    -    0
220 Disk_Shift              -O----   100   100   000    -    0
222 Loaded_Hours            -O--CK   089   089   000    -    4424
223 Load_Retry_Count        -O--CK   100   100   000    -    0
224 Load_Friction           -O---K   100   100   000    -    0
226 Load-in_Time            -OS--K   100   100   000    -    186
240 Head_Flying_Hours       P-----   100   100   001    -    0
                            ||||||_ K auto-keep
                            |||||__ C event count
                            ||||___ R error rate
                            |||____ S speed/performance
                            ||_____ O updated online
                            |______ P prefailure warning

General Purpose Log Directory Version 1
SMART           Log Directory Version 1 [multi-sector log support]
Address    Access  R/W   Size  Description
0x00       GPL,SL  R/O      1  Log Directory
0x01           SL  R/O      1  Summary SMART error log
0x02           SL  R/O     51  Comprehensive SMART error log
0x03       GPL     R/O     64  Ext. Comprehensive SMART error log
0x04       GPL,SL  R/O      8  Device Statistics log
0x06           SL  R/O      1  SMART self-test log
0x07       GPL     R/O      1  Extended self-test log
0x09           SL  R/W      1  Selective self-test log
0x10       GPL     R/O      1  SATA NCQ Queued Error log
0x11       GPL     R/O      1  SATA Phy Event Counters log
0x80-0x9f  GPL,SL  R/W     16  Host vendor specific log
0xe0       GPL,SL  R/W      1  SCT Command/Status
0xe1       GPL,SL  R/W      1  SCT Data Transfer

SMART Extended Comprehensive Error Log Version: 1 (64 sectors)
Device Error Count: 206
	CR     = Command Register
	FEATR  = Features Register
	COUNT  = Count (was: Sector Count) Register
	LBA_48 = Upper bytes of LBA High/Mid/Low Registers ]  ATA-8
	LH     = LBA High (was: Cylinder High) Register    ]   LBA
	LM     = LBA Mid (was: Cylinder Low) Register      ] Register
	LL     = LBA Low (was: Sector Number) Register     ]
	DV     = Device (was: Device/Head) Register
	DC     = Device Control Register
	ER     = Error register
	ST     = Status register
Powered_Up_Time is measured from power on, and printed as
DDd+hh:mm:SS.sss where DD=days, hh=hours, mm=minutes,
SS=sec, and sss=millisec. It "wraps" after 49.710 days.

Error 206 [205] occurred at disk power-on lifetime: 1008 hours (42 days + 0 hours)
  When the command that caused the error occurred, the device was active or idle.

  After command completion occurred, registers were:
  ER -- ST COUNT  LBA_48  LH LM LL DV DC
  -- -- -- == -- == == == -- -- -- -- --
  40 -- 41 00 00 00 00 00 4b 5c 38 40 00  Error: UNC at LBA = 0x004b5c38 = 4938808

  Commands leading to the command that caused the error were:
  CR FEATR COUNT  LBA_48  LH LM LL DV DC  Powered_Up_Time  Command/Feature_Name
  -- == -- == -- == == == -- -- -- -- --  ---------------  --------------------
  60 00 08 00 08 00 00 18 e6 48 a0 40 00     01:39:04.091  READ FPDMA QUEUED
  60 00 80 00 00 00 00 00 4b 5c 28 40 00     01:39:00.356  READ FPDMA QUEUED
  60 00 08 00 00 00 00 05 10 a0 b8 40 00     01:39:00.353  READ FPDMA QUEUED
  60 00 08 00 00 00 00 05 10 a0 98 40 00     01:39:00.353  READ FPDMA QUEUED
  60 00 08 00 00 00 00 05 10 a0 b0 40 00     01:39:00.353  READ FPDMA QUEUED

Error 205 [204] occurred at disk power-on lifetime: 1008 hours (42 days + 0 hours)
  When the command that caused the error occurred, the device was active or idle.

  After command completion occurred, registers were:
  ER -- ST COUNT  LBA_48  LH LM LL DV DC
  -- -- -- == -- == == == -- -- -- -- --
  40 -- 41 00 00 00 00 00 4b 5c 38 40 00  Error: UNC at LBA = 0x004b5c38 = 4938808

  Commands leading to the command that caused the error were:
  CR FEATR COUNT  LBA_48  LH LM LL DV DC  Powered_Up_Time  Command/Feature_Name
  -- == -- == -- == == == -- -- -- -- --  ---------------  --------------------
  60 00 08 00 10 00 00 00 86 2f b0 40 00     01:38:58.310  READ FPDMA QUEUED
  60 00 08 00 10 00 00 00 86 2f a8 40 00     01:38:57.818  READ FPDMA QUEUED
  60 00 08 00 10 00 00 00 86 2f a0 40 00     01:38:57.326  READ FPDMA QUEUED
  61 00 08 00 10 00 00 00 23 4c e8 40 00     01:38:56.963  WRITE FPDMA QUEUED
  60 00 08 00 10 00 00 00 86 2f 98 40 00     01:38:56.833  READ FPDMA QUEUED

Error 204 [203] occurred at disk power-on lifetime: 1008 hours (42 days + 0 hours)
  When the command that caused the error occurred, the device was active or idle.

  After command completion occurred, registers were:
  ER -- ST COUNT  LBA_48  LH LM LL DV DC
  -- -- -- == -- == == == -- -- -- -- --
  40 -- 41 00 00 00 00 00 4b 5c 38 40 00  Error: UNC at LBA = 0x004b5c38 = 4938808

  Commands leading to the command that caused the error were:
  CR FEATR COUNT  LBA_48  LH LM LL DV DC  Powered_Up_Time  Command/Feature_Name
  -- == -- == -- == == == -- -- -- -- --  ---------------  --------------------
  60 00 08 00 10 00 00 00 86 2f 80 40 00     01:38:55.461  READ FPDMA QUEUED
  60 00 08 00 10 00 00 00 86 2f 78 40 00     01:38:54.969  READ FPDMA QUEUED
  60 00 08 00 10 00 00 00 86 2f 70 40 00     01:38:54.477  READ FPDMA QUEUED
  60 00 08 00 10 00 00 00 86 2f 68 40 00     01:38:53.984  READ FPDMA QUEUED
  60 00 08 00 10 00 00 00 86 2f 60 40 00     01:38:53.492  READ FPDMA QUEUED

Error 203 [202] occurred at disk power-on lifetime: 1008 hours (42 days + 0 hours)
  When the command that caused the error occurred, the device was active or idle.

  After command completion occurred, registers were:
  ER -- ST COUNT  LBA_48  LH LM LL DV DC
  -- -- -- == -- == == == -- -- -- -- --
  40 -- 41 00 00 00 00 00 4b 5c 38 40 00  Error: WP at LBA = 0x004b5c38 = 4938808

  Commands leading to the command that caused the error were:
  CR FEATR COUNT  LBA_48  LH LM LL DV DC  Powered_Up_Time  Command/Feature_Name
  -- == -- == -- == == == -- -- -- -- --  ---------------  --------------------
  61 00 08 00 10 00 00 00 7f 19 e8 40 00     01:38:48.987  WRITE FPDMA QUEUED
  61 00 10 00 10 00 00 00 80 56 f0 40 00     01:38:48.987  WRITE FPDMA QUEUED
  60 00 08 00 10 00 00 00 86 2f 38 40 00     01:38:48.537  READ FPDMA QUEUED
  60 00 08 00 08 00 00 05 a2 e4 60 40 00     01:38:48.055  READ FPDMA QUEUED
  60 00 08 00 00 00 00 00 4b 5c 38 40 00     01:38:48.009  READ FPDMA QUEUED

Error 202 [201] occurred at disk power-on lifetime: 1008 hours (42 days + 0 hours)
  When the command that caused the error occurred, the device was active or idle.

  After command completion occurred, registers were:
  ER -- ST COUNT  LBA_48  LH LM LL DV DC
  -- -- -- == -- == == == -- -- -- -- --
  40 -- 41 00 00 00 00 00 4b 5c 38 40 00  Error: UNC at LBA = 0x004b5c38 = 4938808

  Commands leading to the command that caused the error were:
  CR FEATR COUNT  LBA_48  LH LM LL DV DC  Powered_Up_Time  Command/Feature_Name
  -- == -- == -- == == == -- -- -- -- --  ---------------  --------------------
  60 00 08 00 08 00 00 01 fa 83 90 40 00     01:38:47.852  READ FPDMA QUEUED
  60 00 08 00 00 00 00 00 4b 5c 38 40 00     01:38:44.129  READ FPDMA QUEUED
  60 00 08 00 00 00 00 00 86 2f 10 40 00     01:38:44.129  READ FPDMA QUEUED
  61 00 08 00 00 00 00 00 83 62 58 40 00     01:38:44.128  WRITE FPDMA QUEUED
  60 00 08 00 00 00 00 00 4b 5c 30 40 00     01:38:44.113  READ FPDMA QUEUED

Error 201 [200] occurred at disk power-on lifetime: 1008 hours (42 days + 0 hours)
  When the command that caused the error occurred, the device was active or idle.

  After command completion occurred, registers were:
  ER -- ST COUNT  LBA_48  LH LM LL DV DC
  -- -- -- == -- == == == -- -- -- -- --
  40 -- 41 00 00 00 00 00 4b 5c 38 40 00  Error: UNC at LBA = 0x004b5c38 = 4938808

  Commands leading to the command that caused the error were:
  CR FEATR COUNT  LBA_48  LH LM LL DV DC  Powered_Up_Time  Command/Feature_Name
  -- == -- == -- == == == -- -- -- -- --  ---------------  --------------------
  60 00 08 00 08 00 00 00 c0 4f 40 40 00     01:38:43.840  READ FPDMA QUEUED
  60 00 80 00 00 00 00 00 4b 5c 28 40 00     01:38:40.100  READ FPDMA QUEUED
  60 00 08 00 00 00 00 00 86 2e f8 40 00     01:38:40.100  READ FPDMA QUEUED
  60 00 80 00 00 00 00 00 4b 5b a8 40 00     01:38:40.099  READ FPDMA QUEUED
  60 00 08 00 00 00 00 00 86 2e f0 40 00     01:38:40.087  READ FPDMA QUEUED

Error 200 [199] occurred at disk power-on lifetime: 1003 hours (41 days + 19 hours)
  When the command that caused the error occurred, the device was active or idle.

  After command completion occurred, registers were:
  ER -- ST COUNT  LBA_48  LH LM LL DV DC
  -- -- -- == -- == == == -- -- -- -- --
  40 -- 41 00 00 00 00 00 4b 5c 38 40 00  Error: WP at LBA = 0x004b5c38 = 4938808

  Commands leading to the command that caused the error were:
  CR FEATR COUNT  LBA_48  LH LM LL DV DC  Powered_Up_Time  Command/Feature_Name
  -- == -- == -- == == == -- -- -- -- --  ---------------  --------------------
  61 00 38 00 28 00 00 00 7f 1a 08 40 00     02:53:48.337  WRITE FPDMA QUEUED
  61 00 08 00 50 00 00 04 ac 4d e8 40 00     02:53:48.336  WRITE FPDMA QUEUED
  61 00 80 00 48 00 00 01 7c 45 60 40 00     02:53:48.336  WRITE FPDMA QUEUED
  61 00 80 00 40 00 00 01 dd 88 c0 40 00     02:53:48.336  WRITE FPDMA QUEUED
  61 00 80 00 38 00 00 01 7d 1e 20 40 00     02:53:48.336  WRITE FPDMA QUEUED

Error 199 [198] occurred at disk power-on lifetime: 1003 hours (41 days + 19 hours)
  When the command that caused the error occurred, the device was active or idle.

  After command completion occurred, registers were:
  ER -- ST COUNT  LBA_48  LH LM LL DV DC
  -- -- -- == -- == == == -- -- -- -- --
  40 -- 41 00 00 00 00 00 4b 5c 38 40 00  Error: WP at LBA = 0x004b5c38 = 4938808

  Commands leading to the command that caused the error were:
  CR FEATR COUNT  LBA_48  LH LM LL DV DC  Powered_Up_Time  Command/Feature_Name
  -- == -- == -- == == == -- -- -- -- --  ---------------  --------------------
  61 00 28 00 08 00 00 00 7f 19 68 40 00     02:53:43.572  WRITE FPDMA QUEUED
  60 00 08 00 00 00 00 00 4b 5c 38 40 00     02:53:43.074  READ FPDMA QUEUED
  60 00 58 00 00 00 00 0b 3e 13 30 40 00     02:53:43.071  READ FPDMA QUEUED
  60 00 58 00 00 00 00 00 4b 5c 50 40 00     02:53:43.071  READ FPDMA QUEUED
  60 00 58 00 00 00 00 0b 3e 10 a0 40 00     02:53:43.056  READ FPDMA QUEUED

SMART Extended Self-test Log Version: 1 (1 sectors)
Num  Test_Description    Status                  Remaining  LifeTime(hours)  LBA_of_first_error
# 1  Extended offline    Aborted by host               60%      4745         -
# 2  Extended offline    Completed without error       00%      4665         -
# 3  Extended offline    Completed without error       00%      4630         -
# 4  Extended offline    Aborted by host               90%      4600         -
# 5  Extended offline    Aborted by host               30%      4557         -
# 6  Extended offline    Aborted by host               90%      4518         -
# 7  Extended offline    Aborted by host               60%      4480         -
# 8  Extended offline    Aborted by host               90%      4442         -
# 9  Extended offline    Aborted by host               60%      4401         -
#10  Extended offline    Aborted by host               50%      4360         -
#11  Extended offline    Completed without error       00%      4311         -
#12  Extended offline    Aborted by host               70%      4280         -
#13  Extended offline    Aborted by host               80%      4225         -
#14  Extended offline    Aborted by host               90%      4172         -
#15  Extended offline    Aborted by host               30%      4131         -
#16  Extended offline    Aborted by host               90%      4074         -
#17  Extended offline    Aborted by host               50%      4017         -
#18  Extended offline    Aborted by host               30%      3963         -
#19  Extended offline    Aborted by host               80%      3873         -

SMART Selective self-test log data structure revision number 1
 SPAN  MIN_LBA  MAX_LBA  CURRENT_TEST_STATUS
    1        0        0  Not_testing
    2        0        0  Not_testing
    3        0        0  Not_testing
    4        0        0  Not_testing
    5        0        0  Not_testing
Selective self-test flags (0x0):
  After scanning selected spans, do NOT read-scan remainder of disk.
If Selective self-test is pending on power-up, resume after 0 minute delay.

SCT Status Version:                  2
SCT Version (vendor specific):       1 (0x0001)
SCT Support Level:                   1
Device State:                        Active (0)
Current Temperature:                    36 Celsius
Power Cycle Min/Max Temperature:     35/41 Celsius
Lifetime    Min/Max Temperature:     19/50 Celsius
Under/Over Temperature Limit Count:   0/0

SCT Temperature History Version:     2
Temperature Sampling Period:         1 minute
Temperature Logging Interval:        1 minute
Min/Max recommended Temperature:      5/55 Celsius
Min/Max Temperature Limit:            5/55 Celsius
Temperature History Size (Index):    478 (431)

SCT Error Recovery Control:
           Read: Disabled
          Write: Disabled

Device Statistics (GP Log 0x04)
Page  Offset Size        Value Flags Description
0x01  =====  =               =  ===  == General Statistics (rev 2) ==
0x01  0x008  4            2514  ---  Lifetime Power-On Resets
0x01  0x010  4            4753  ---  Power-on Hours
0x01  0x018  6     17734362735  ---  Logical Sectors Written
0x01  0x020  6       182379424  ---  Number of Write Commands
0x01  0x028  6     22807331690  ---  Logical Sectors Read
0x01  0x030  6       221659323  ---  Number of Read Commands
0x02  =====  =               =  ===  == Free-Fall Statistics (rev 1) ==
0x02  0x010  4              55  ---  Overlimit Shock Events
0x03  =====  =               =  ===  == Rotating Media Statistics (rev 1) ==
0x03  0x008  4            4506  ---  Spindle Motor Power-on Hours
0x03  0x010  4            4424  ---  Head Flying Hours
0x03  0x018  4           23514  ---  Head Load Events
0x03  0x020  4               0  ---  Number of Reallocated Logical Sectors
0x03  0x028  4               0  ---  Read Recovery Attempts
0x03  0x030  4               0  ---  Number of Mechanical Start Failures
0x04  =====  =               =  ===  == General Errors Statistics (rev 1) ==
0x04  0x008  4             206  ---  Number of Reported Uncorrectable Errors
0x04  0x010  4               1  ---  Resets Between Cmd Acceptance and Completion
0x05  =====  =               =  ===  == Temperature Statistics (rev 1) ==
0x05  0x008  1              36  ---  Current Temperature
0x05  0x010  1              36  N--  Average Short Term Temperature
0x05  0x018  1              34  N--  Average Long Term Temperature
0x05  0x020  1              50  ---  Highest Temperature
0x05  0x028  1              19  ---  Lowest Temperature
0x05  0x030  1              39  N--  Highest Average Short Term Temperature
0x05  0x038  1              30  N--  Lowest Average Short Term Temperature
0x05  0x040  1              36  N--  Highest Average Long Term Temperature
0x05  0x048  1              34  N--  Lowest Average Long Term Temperature
0x05  0x050  4               0  ---  Time in Over-Temperature
0x05  0x058  1              55  ---  Specified Maximum Operating Temperature
0x05  0x060  4               0  ---  Time in Under-Temperature
0x05  0x068  1               5  ---  Specified Minimum Operating Temperature
0x06  =====  =               =  ===  == Transport Statistics (rev 1) ==
0x06  0x008  4            1309  ---  Number of Hardware Resets
0x06  0x018  4               0  ---  Number of Interface CRC Errors
0x07  =====  =               =  ===  == Solid State Device Statistics (rev 1) ==
0x07  0x008  1               7  N--  Percentage Used Endurance Indicator
                                |||_ C monitored condition met
                                ||__ D supports DSN
                                |___ N normalized value

SATA Phy Event Counters (GP Log 0x11)
ID      Size     Value  Description
0x0001  4            0  Command failed due to ICRC error
0x0002  4            0  R_ERR response for data FIS
0x0003  4            0  R_ERR response for device-to-host data FIS
0x0004  4            0  R_ERR response for host-to-device data FIS
0x0005  4            0  R_ERR response for non-data FIS
0x0006  4            0  R_ERR response for device-to-host non-data FIS
0x0007  4            0  R_ERR response for host-to-device non-data FIS
0x0008  4            0  Device-to-host non-data FIS retries
0x0009  4            3  Transition from drive PhyRdy to drive PhyNRdy
0x000a  4            0  Device-to-host register FISes sent due to a COMRESET
0x000b  4            0  CRC errors within host-to-device FIS
0x000d  4            0  Non-CRC errors within host-to-device FIS
0x000f  4            0  R_ERR response for host-to-device data FIS, CRC
0x0010  4            0  R_ERR response for host-to-device data FIS, non-CRC
0x0012  4            0  R_ERR response for host-to-device non-data FIS, CRC
0x0013  4            0  R_ERR response for host-to-device non-data FIS, non-CRC

