=== START OF INFORMATION SECTION ===
Model Family:     Hitachi Travelstar 5K320
Device Model:     Hitachi HTS543232L9SA02
Serial Number:    --
LU WWN Device Id: 5 000cca ...
Firmware Version: FB4AC52F
User Capacity:    320,072,933,376 bytes [320 GB]
Sector Size:      512 bytes logical/physical
Rotation Rate:    5400 rpm
Device is:        In smartctl database [for details use: -P show]
ATA Version is:   ATA8-ACS T13/1699-D revision 3f
SATA Version is:  SATA 2.6, 1.5 Gb/s
Local Time is:    Fri Jun  8 18:29:06 2018 +05
SMART support is: Available - device has SMART capability.
SMART support is: Enabled
AAM feature is:   Disabled
APM level is:     254 (maximum performance)
Rd look-ahead is: Enabled
Write cache is:   Enabled
DSN feature is:   Unavailable
ATA Security is:  Disabled, frozen [SEC2]
Wt Cache Reorder: Enabled

=== START OF READ SMART DATA SECTION ===
SMART overall-health self-assessment test result: PASSED

General SMART Values:
Offline data collection status:  (0x82)	Offline data collection activity
					was completed without error.
					Auto Offline Data Collection: Enabled.
Self-test execution status:      (   0)	The previous self-test routine completed
					without error or no self-test has ever 
					been run.
Total time to complete Offline 
data collection: 		(  645) seconds.
Offline data collection
capabilities: 			 (0x5b) SMART execute Offline immediate.
					Auto Offline data collection on/off support.
					Suspend Offline collection upon new
					command.
					Offline surface scan supported.
					Self-test supported.
					No Conveyance Self-test supported.
					Selective Self-test supported.
SMART capabilities:            (0x0003)	Saves SMART data before entering
					power-saving mode.
					Supports SMART auto save timer.
Error logging capability:        (0x01)	Error logging supported.
					General Purpose Logging supported.
Short self-test routine 
recommended polling time: 	 (   2) minutes.
Extended self-test routine
recommended polling time: 	 ( 127) minutes.
SCT capabilities: 	       (0x003d)	SCT Status supported.
					SCT Error Recovery Control supported.
					SCT Feature Control supported.
					SCT Data Table supported.

SMART Attributes Data Structure revision number: 16
Vendor Specific SMART Attributes with Thresholds:
ID# ATTRIBUTE_NAME          FLAGS    VALUE WORST THRESH FAIL RAW_VALUE
  1 Raw_Read_Error_Rate     PO-R--   100   100   062    -    0
  2 Throughput_Performance  P-S---   109   109   040    -    4401
  3 Spin_Up_Time            POS---   253   253   033    -    0
  4 Start_Stop_Count        -O--C-   096   096   000    -    7233
  5 Reallocated_Sector_Ct   PO--CK   100   100   005    -    41
  7 Seek_Error_Rate         PO-R--   100   100   067    -    0
  8 Seek_Time_Performance   P-S---   134   134   040    -    33
  9 Power_On_Hours          -O--C-   022   022   000    -    34214
 10 Spin_Retry_Count        PO--C-   100   100   060    -    0
 12 Power_Cycle_Count       -O--CK   096   096   000    -    6724
160 Unknown_Attribute       -O--CK   100   100   000    -    0
191 G-Sense_Error_Rate      -O-R--   100   100   000    -    23003844837376
192 Power-Off_Retract_Count -O--CK   100   100   000    -    101
193 Load_Cycle_Count        -O--C-   001   001   000    -    1967867
194 Temperature_Celsius     -O----   107   107   000    -    51 (Min/Max 16/59)
195 Hardware_ECC_Recovered  -O-R--   100   100   000    -    0
196 Reallocated_Event_Count -O--CK   100   100   000    -    39
197 Current_Pending_Sector  -O---K   100   100   000    -    0
198 Offline_Uncorrectable   ---R--   100   100   000    -    0
199 UDMA_CRC_Error_Count    -O-R--   200   200   000    -    0
223 Load_Retry_Count        -O-R--   100   100   000    -    0
254 Free_Fall_Sensor        -O--CK   100   100   000    -    11
                            ||||||_ K auto-keep
                            |||||__ C event count
                            ||||___ R error rate
                            |||____ S speed/performance
                            ||_____ O updated online
                            |______ P prefailure warning

General Purpose Log Directory Version 1
SMART           Log Directory Version 1 [multi-sector log support]
Address    Access  R/W   Size  Description
0x00       GPL,SL  R/O      1  Log Directory
0x01           SL  R/O      1  Summary SMART error log
0x02           SL  R/O      1  Comprehensive SMART error log
0x03       GPL     R/O      1  Ext. Comprehensive SMART error log
0x06           SL  R/O      1  SMART self-test log
0x07       GPL     R/O      1  Extended self-test log
0x09           SL  R/W      1  Selective self-test log
0x10       GPL     R/O      1  NCQ Command Error log
0x11       GPL     R/O      1  SATA Phy Event Counters log
0x80-0x9f  GPL,SL  R/W     16  Host vendor specific log
0xa2           SL  VS       1  Device vendor specific log

SMART Extended Comprehensive Error Log Version: 1 (1 sectors)
Device Error Count: 12 (device log contains only the most recent 4 errors)
	CR     = Command Register
	FEATR  = Features Register
	COUNT  = Count (was: Sector Count) Register
	LBA_48 = Upper bytes of LBA High/Mid/Low Registers ]  ATA-8
	LH     = LBA High (was: Cylinder High) Register    ]   LBA
	LM     = LBA Mid (was: Cylinder Low) Register      ] Register
	LL     = LBA Low (was: Sector Number) Register     ]
	DV     = Device (was: Device/Head) Register
	DC     = Device Control Register
	ER     = Error register
	ST     = Status register
Powered_Up_Time is measured from power on, and printed as
DDd+hh:mm:SS.sss where DD=days, hh=hours, mm=minutes,
SS=sec, and sss=millisec. It "wraps" after 49.710 days.

Error 12 [3] occurred at disk power-on lifetime: 3947 hours (164 days + 11 hours)
  When the command that caused the error occurred, the device was active or idle.

  After command completion occurred, registers were:
  ER -- ST COUNT  LBA_48  LH LM LL DV DC
  -- -- -- == -- == == == -- -- -- -- --
  40 -- 51 01 4d 00 00 15 1b 9d 8b 45 00  Error: UNC 333 sectors at LBA = 0x151b9d8b = 354131339

  Commands leading to the command that caused the error were:
  CR FEATR COUNT  LBA_48  LH LM LL DV DC  Powered_Up_Time  Command/Feature_Name
  -- == -- == -- == == == -- -- -- -- --  ---------------  --------------------
  25 00 00 02 00 00 00 15 1b 9c d8 40 00     19:56:42.800  READ DMA EXT
  ef 00 05 00 80 00 00 00 00 00 00 00 00     19:56:42.800  SET FEATURES [Enable APM]
  ef 00 10 00 02 00 00 00 00 00 00 00 00     19:56:42.800  SET FEATURES [Enable SATA feature]
  ef 00 02 00 00 00 00 00 00 00 00 00 00     19:56:42.800  SET FEATURES [Enable write cache]
  ef 00 aa 00 00 00 00 00 00 00 00 00 00     19:56:42.800  SET FEATURES [Enable read look-ahead]

Error 11 [2] occurred at disk power-on lifetime: 3947 hours (164 days + 11 hours)
  When the command that caused the error occurred, the device was active or idle.

  After command completion occurred, registers were:
  ER -- ST COUNT  LBA_48  LH LM LL DV DC
  -- -- -- == -- == == == -- -- -- -- --
  40 -- 51 01 4d 00 00 15 1b 9d 8b 45 00  Error: UNC 333 sectors at LBA = 0x151b9d8b = 354131339

  Commands leading to the command that caused the error were:
  CR FEATR COUNT  LBA_48  LH LM LL DV DC  Powered_Up_Time  Command/Feature_Name
  -- == -- == -- == == == -- -- -- -- --  ---------------  --------------------
  25 00 00 02 00 00 00 15 1b 9c d8 40 00     19:56:12.700  READ DMA EXT
  25 00 00 02 00 00 00 15 1b 9c d8 40 00     19:56:08.600  READ DMA EXT
  25 00 00 00 50 00 00 00 37 68 b0 40 00     19:56:08.600  READ DMA EXT
  25 00 00 02 00 00 00 15 1b 9c d8 40 00     19:56:04.500  READ DMA EXT
  2f 00 00 00 01 00 00 00 00 00 10 00 00     19:56:04.500  READ LOG EXT

Error 10 [1] occurred at disk power-on lifetime: 3947 hours (164 days + 11 hours)
  When the command that caused the error occurred, the device was active or idle.

  After command completion occurred, registers were:
  ER -- ST COUNT  LBA_48  LH LM LL DV DC
  -- -- -- == -- == == == -- -- -- -- --
  40 -- 51 01 4d 00 00 15 1b 9d 8b 45 00  Error: UNC 333 sectors at LBA = 0x151b9d8b = 354131339

  Commands leading to the command that caused the error were:
  CR FEATR COUNT  LBA_48  LH LM LL DV DC  Powered_Up_Time  Command/Feature_Name
  -- == -- == -- == == == -- -- -- -- --  ---------------  --------------------
  25 00 00 02 00 00 00 15 1b 9c d8 40 00     19:56:08.600  READ DMA EXT
  25 00 00 00 50 00 00 00 37 68 b0 40 00     19:56:08.600  READ DMA EXT
  25 00 00 02 00 00 00 15 1b 9c d8 40 00     19:56:04.500  READ DMA EXT
  2f 00 00 00 01 00 00 00 00 00 10 00 00     19:56:04.500  READ LOG EXT
  60 02 00 00 c0 00 00 15 1b 9c d8 40 00     19:56:00.600  READ FPDMA QUEUED

Error 9 [0] occurred at disk power-on lifetime: 3947 hours (164 days + 11 hours)
  When the command that caused the error occurred, the device was active or idle.

  After command completion occurred, registers were:
  ER -- ST COUNT  LBA_48  LH LM LL DV DC
  -- -- -- == -- == == == -- -- -- -- --
  40 -- 51 01 4d 00 00 15 1b 9d 8b 45 00  Error: UNC 333 sectors at LBA = 0x151b9d8b = 354131339

  Commands leading to the command that caused the error were:
  CR FEATR COUNT  LBA_48  LH LM LL DV DC  Powered_Up_Time  Command/Feature_Name
  -- == -- == -- == == == -- -- -- -- --  ---------------  --------------------
  25 00 00 02 00 00 00 15 1b 9c d8 40 00     19:56:04.500  READ DMA EXT
  2f 00 00 00 01 00 00 00 00 00 10 00 00     19:56:04.500  READ LOG EXT
  60 02 00 00 c0 00 00 15 1b 9c d8 40 00     19:56:00.600  READ FPDMA QUEUED
  60 02 00 00 b8 00 00 15 1b 9a d8 40 00     19:56:00.600  READ FPDMA QUEUED
  60 02 00 00 b0 00 00 15 1b 98 d8 40 00     19:56:00.600  READ FPDMA QUEUED

SMART Extended Self-test Log Version: 1 (1 sectors)
Num  Test_Description    Status                  Remaining  LifeTime(hours)  LBA_of_first_error
# 1  Extended offline    Completed without error       00%     34057         -
# 2  Extended offline    Completed without error       00%     33162         -
# 3  Extended offline    Completed without error       00%     33018         -
# 4  Extended offline    Completed without error       00%     32678         -
# 5  Extended offline    Completed without error       00%     32603         -
# 6  Extended offline    Completed without error       00%     32511         -
# 7  Extended offline    Completed without error       00%     32462         -
# 8  Extended offline    Completed without error       00%     32381         -
# 9  Extended offline    Completed without error       00%     32295         -
#10  Extended offline    Completed without error       00%     32221         -
#11  Extended offline    Completed without error       00%     32129         -
#12  Extended offline    Completed without error       00%     32060         -
#13  Extended offline    Completed without error       00%     31971         -
#14  Extended offline    Completed without error       00%     31644         -
#15  Extended offline    Completed without error       00%     31494         -
#16  Extended offline    Completed without error       00%     31175         -
#17  Extended offline    Completed without error       00%     31007         -
#18  Extended offline    Completed without error       00%     30839         -

SMART Selective self-test log data structure revision number 1
 SPAN  MIN_LBA  MAX_LBA  CURRENT_TEST_STATUS
    1        0        0  Not_testing
    2        0        0  Not_testing
    3        0        0  Not_testing
    4        0        0  Not_testing
    5        0        0  Not_testing
Selective self-test flags (0x0):
  After scanning selected spans, do NOT read-scan remainder of disk.
If Selective self-test is pending on power-up, resume after 0 minute delay.

SCT Status Version:                  3
SCT Version (vendor specific):       256 (0x0100)
SCT Support Level:                   1
Device State:                        Active (0)
Current Temperature:                    51 Celsius
Power Cycle Min/Max Temperature:     51/53 Celsius
Lifetime    Min/Max Temperature:     16/59 Celsius
Lifetime    Average Temperature:        49 Celsius
Under/Over Temperature Limit Count:   0/0

SCT Temperature History Version:     2
Temperature Sampling Period:         1 minute
Temperature Logging Interval:        1 minute
Min/Max recommended Temperature:      5/60 Celsius
Min/Max Temperature Limit:           -40/65 Celsius
Temperature History Size (Index):    478 (171)

SCT Error Recovery Control:
           Read: Disabled
          Write: Disabled

Device Statistics (GP/SMART Log 0x04) not supported

Pending Defects log (GP Log 0x0c) not supported

SATA Phy Event Counters (GP Log 0x11)
ID      Size     Value  Description
0x0001  2            0  Command failed due to ICRC error
0x0002  2            0  R_ERR response for data FIS
0x0005  2            0  R_ERR response for non-data FIS
0x0009  2            4  Transition from drive PhyRdy to drive PhyNRdy
0x000a  2            2  Device-to-host register FISes sent due to a COMRESET
0x000b  2            0  CRC errors within host-to-device FIS
0x000d  2            0  Non-CRC errors within host-to-device FIS

