=== START OF INFORMATION SECTION ===
Model Family:     SAMSUNG SpinPoint P120
Device Model:     SAMSUNG SP2504C
Serial Number:    --
Firmware Version: VT100-41
User Capacity:    250 058 268 160 bytes [250 GB]
Sector Size:      512 bytes logical/physical
Device is:        In smartctl database [for details use: -P show]
ATA Version is:   ATA/ATAPI-7 T13/1532D revision 4a
Local Time is:    Sun Jul  9 09:53:56 2017 MSK

==> WARNING: May need -F samsung3 enabled; see manual for details.

SMART support is: Available - device has SMART capability.
SMART support is: Enabled
AAM feature is:   Disabled
APM feature is:   Unavailable
Rd look-ahead is: Enabled
Write cache is:   Enabled
ATA Security is:  Disabled, frozen [SEC2]
Wt Cache Reorder: Enabled

=== START OF READ SMART DATA SECTION ===
SMART overall-health self-assessment test result: PASSED

General SMART Values:
Offline data collection status:  (0x82)	Offline data collection activity
					was completed without error.
					Auto Offline Data Collection: Enabled.
Self-test execution status:      ( 117)	The previous self-test completed having
					the read element of the test failed.
Total time to complete Offline 
data collection: 		( 4835) seconds.
Offline data collection
capabilities: 			 (0x5b) SMART execute Offline immediate.
					Auto Offline data collection on/off support.
					Suspend Offline collection upon new
					command.
					Offline surface scan supported.
					Self-test supported.
					No Conveyance Self-test supported.
					Selective Self-test supported.
SMART capabilities:            (0x0003)	Saves SMART data before entering
					power-saving mode.
					Supports SMART auto save timer.
Error logging capability:        (0x01)	Error logging supported.
					General Purpose Logging supported.
Short self-test routine 
recommended polling time: 	 (   1) minutes.
Extended self-test routine
recommended polling time: 	 (  80) minutes.
SCT capabilities: 	       (0x003f)	SCT Status supported.
					SCT Error Recovery Control supported.
					SCT Feature Control supported.
					SCT Data Table supported.

SMART Attributes Data Structure revision number: 16
Vendor Specific SMART Attributes with Thresholds:
ID# ATTRIBUTE_NAME          FLAGS    VALUE WORST THRESH FAIL RAW_VALUE
  1 Raw_Read_Error_Rate     POSR--   253   100   051    -    0
  3 Spin_Up_Time            POS---   100   100   025    -    6144
  4 Start_Stop_Count        -O--CK   080   080   000    -    21184
  5 Reallocated_Sector_Ct   PO--CK   253   253   010    -    0
  7 Seek_Error_Rate         POSR--   253   253   051    -    0
  8 Seek_Time_Performance   P-S--K   253   253   015    -    0
  9 Power_On_Hours          -O--CK   100   100   000    -    28415
 10 Spin_Retry_Count        PO--CK   253   253   051    -    0
 11 Calibration_Retry_Count -O--C-   253   253   000    -    0
 12 Power_Cycle_Count       -O--CK   089   089   000    -    11447
187 Reported_Uncorrect      -O--CK   001   001   000    -    853306
190 Airflow_Temperature_Cel -O---K   139   082   000    -    33
194 Temperature_Celsius     -O---K   139   082   000    -    33
195 Hardware_ECC_Recovered  -O-RC-   100   100   000    -    13194
196 Reallocated_Event_Count -O--CK   253   253   000    -    0
197 Current_Pending_Sector  -O--C-   100   100   000    -    1
198 Offline_Uncorrectable   ----CK   253   100   000    -    0
199 UDMA_CRC_Error_Count    -OSRCK   200   200   000    -    0
200 Multi_Zone_Error_Rate   -O-R--   253   100   000    -    0
201 Soft_Read_Error_Rate    -O-R--   253   100   000    -    0
202 Data_Address_Mark_Errs  -O--CK   253   253   000    -    0
                            ||||||_ K auto-keep
                            |||||__ C event count
                            ||||___ R error rate
                            |||____ S speed/performance
                            ||_____ O updated online
                            |______ P prefailure warning

General Purpose Log Directory Version 1
SMART           Log Directory Version 1 [multi-sector log support]
Address    Access  R/W   Size  Description
0x00       GPL,SL  R/O      1  Log Directory
0x01           SL  R/O      1  Summary SMART error log
0x02           SL  R/O      2  Comprehensive SMART error log
0x03       GPL     R/O      2  Ext. Comprehensive SMART error log
0x06           SL  R/O      1  SMART self-test log
0x10       GPL     R/O      1  SATA NCQ Queued Error log
0x11       GPL     R/O      1  SATA Phy Event Counters log
0x80-0x9f  GPL,SL  R/W     16  Host vendor specific log

SMART Extended Comprehensive Error Log Version: 1 (2 sectors)
Invalid Error Log index = 0x0000, trying reserved byte (0x04) instead
Device Error Count: 1348 (device log contains only the most recent 8 errors)
	CR     = Command Register
	FEATR  = Features Register
	COUNT  = Count (was: Sector Count) Register
	LBA_48 = Upper bytes of LBA High/Mid/Low Registers ]  ATA-8
	LH     = LBA High (was: Cylinder High) Register    ]   LBA
	LM     = LBA Mid (was: Cylinder Low) Register      ] Register
	LL     = LBA Low (was: Sector Number) Register     ]
	DV     = Device (was: Device/Head) Register
	DC     = Device Control Register
	ER     = Error register
	ST     = Status register
Powered_Up_Time is measured from power on, and printed as
DDd+hh:mm:SS.sss where DD=days, hh=hours, mm=minutes,
SS=sec, and sss=millisec. It "wraps" after 49.710 days.

Error 1348 [3] occurred at disk power-on lifetime: 28383 hours (1182 days + 15 hours)
  When the command that caused the error occurred, the device was active or idle.

  After command completion occurred, registers were:
  ER -- ST COUNT  LBA_48  LH LM LL DV DC
  -- -- -- == -- == == == -- -- -- -- --
  40 -- 51 00 08 00 00 0e 1a 00 08 e0 00  Error: UNC 8 sectors at LBA = 0x0e1a0008 = 236584968

  Commands leading to the command that caused the error were:
  CR FEATR COUNT  LBA_48  LH LM LL DV DC  Powered_Up_Time  Command/Feature_Name
  -- == -- == -- == == == -- -- -- -- --  ---------------  --------------------
  25 00 00 00 08 00 00 0e 1a 00 08 e0 00     07:02:45.813  READ DMA EXT
  25 00 00 00 40 00 00 0c 3b 55 22 e0 00     07:02:44.063  READ DMA EXT
  35 00 00 01 00 00 00 03 d7 b1 68 e0 00     07:02:44.063  WRITE DMA EXT
  35 00 00 01 00 00 00 03 d7 b0 68 e0 00     07:02:44.063  WRITE DMA EXT
  35 00 00 01 00 00 00 03 d7 af 68 e0 00     07:02:44.063  WRITE DMA EXT

Error 1347 [2] occurred at disk power-on lifetime: 28383 hours (1182 days + 15 hours)
  When the command that caused the error occurred, the device was active or idle.

  After command completion occurred, registers were:
  ER -- ST COUNT  LBA_48  LH LM LL DV DC
  -- -- -- == -- == == == -- -- -- -- --
  40 -- 51 00 20 00 00 0e 1a 00 00 e0 00  Error: UNC 32 sectors at LBA = 0x0e1a0000 = 236584960

  Commands leading to the command that caused the error were:
  CR FEATR COUNT  LBA_48  LH LM LL DV DC  Powered_Up_Time  Command/Feature_Name
  -- == -- == -- == == == -- -- -- -- --  ---------------  --------------------
  25 00 00 00 20 00 00 0e 1a 00 00 e0 00     07:02:44.000  READ DMA EXT
  25 00 00 00 40 00 00 0c 50 46 42 e0 00     07:02:42.250  READ DMA EXT
  25 00 00 00 01 00 00 0c 35 08 00 e0 00     07:02:42.250  READ DMA EXT
  35 00 00 00 20 00 00 10 af 1c 60 e0 00     07:02:42.250  WRITE DMA EXT
  25 00 00 00 60 00 00 10 80 39 40 e0 00     07:02:42.250  READ DMA EXT

Error 1346 [1] occurred at disk power-on lifetime: 28341 hours (1180 days + 21 hours)
  When the command that caused the error occurred, the device was active or idle.

  After command completion occurred, registers were:
  ER -- ST COUNT  LBA_48  LH LM LL DV DC
  -- -- -- == -- == == == -- -- -- -- --
  40 -- 51 00 08 00 00 0e 1a 00 08 e0 00  Error: UNC 8 sectors at LBA = 0x0e1a0008 = 236584968

  Commands leading to the command that caused the error were:
  CR FEATR COUNT  LBA_48  LH LM LL DV DC  Powered_Up_Time  Command/Feature_Name
  -- == -- == -- == == == -- -- -- -- --  ---------------  --------------------
  25 00 00 00 08 00 00 0e 1a 00 08 e0 00     08:18:18.375  READ DMA EXT
  25 00 00 00 20 00 00 0c 35 44 60 e0 00     08:18:16.625  READ DMA EXT
  25 00 00 00 20 00 00 0d 19 f7 a0 e0 00     08:18:16.625  READ DMA EXT
  25 00 00 00 08 00 00 0e 1a 00 00 e0 00     08:18:16.625  READ DMA EXT
  25 00 00 00 20 00 00 0c 35 44 60 e0 00     08:18:16.625  READ DMA EXT

Error 1345 [0] occurred at disk power-on lifetime: 28341 hours (1180 days + 21 hours)
  When the command that caused the error occurred, the device was active or idle.

  After command completion occurred, registers were:
  ER -- ST COUNT  LBA_48  LH LM LL DV DC
  -- -- -- == -- == == == -- -- -- -- --
  40 -- 51 00 20 00 00 0e 1a 00 00 e0 00  Error: UNC 32 sectors at LBA = 0x0e1a0000 = 236584960

  Commands leading to the command that caused the error were:
  CR FEATR COUNT  LBA_48  LH LM LL DV DC  Powered_Up_Time  Command/Feature_Name
  -- == -- == -- == == == -- -- -- -- --  ---------------  --------------------
  25 00 00 00 20 00 00 0e 1a 00 00 e0 00     08:18:16.563  READ DMA EXT
  25 00 00 00 40 00 00 11 00 ec a8 e0 00     08:18:14.813  READ DMA EXT
  35 00 00 00 20 00 00 10 80 39 c0 e0 00     08:18:14.813  WRITE DMA EXT
  25 00 00 00 60 00 00 11 4d eb e0 e0 00     08:18:14.813  READ DMA EXT
  25 00 00 01 00 00 00 11 4d ea e0 e0 00     08:18:14.813  READ DMA EXT

Error 1344 [7] occurred at disk power-on lifetime: 28224 hours (1176 days + 0 hours)
  When the command that caused the error occurred, the device was active or idle.

  After command completion occurred, registers were:
  ER -- ST COUNT  LBA_48  LH LM LL DV DC
  -- -- -- == -- == == == -- -- -- -- --
  40 -- 51 00 08 00 00 0e 1a 00 08 e0 00  Error: UNC 8 sectors at LBA = 0x0e1a0008 = 236584968

  Commands leading to the command that caused the error were:
  CR FEATR COUNT  LBA_48  LH LM LL DV DC  Powered_Up_Time  Command/Feature_Name
  -- == -- == -- == == == -- -- -- -- --  ---------------  --------------------
  25 00 00 00 08 00 00 0e 1a 00 08 e0 00     06:28:16.313  READ DMA EXT
  35 00 00 00 08 00 00 0c 90 f6 e8 e0 00     06:28:14.625  WRITE DMA EXT
  25 00 00 00 20 00 00 0c 35 44 60 e0 00     06:28:14.625  READ DMA EXT
  25 00 00 00 08 00 00 0e 1a 00 00 e0 00     06:28:14.625  READ DMA EXT
  25 00 00 00 20 00 00 0d 76 5c 40 e0 00     06:28:14.625  READ DMA EXT

Error 1343 [6] occurred at disk power-on lifetime: 28224 hours (1176 days + 0 hours)
  When the command that caused the error occurred, the device was active or idle.

  After command completion occurred, registers were:
  ER -- ST COUNT  LBA_48  LH LM LL DV DC
  -- -- -- == -- == == == -- -- -- -- --
  40 -- 51 00 20 00 00 0e 1a 00 00 e0 00  Error: UNC 32 sectors at LBA = 0x0e1a0000 = 236584960

  Commands leading to the command that caused the error were:
  CR FEATR COUNT  LBA_48  LH LM LL DV DC  Powered_Up_Time  Command/Feature_Name
  -- == -- == -- == == == -- -- -- -- --  ---------------  --------------------
  25 00 00 00 20 00 00 0e 1a 00 00 e0 00     06:28:14.438  READ DMA EXT
  35 00 00 00 20 00 00 11 4d ec 60 e0 00     06:28:12.688  WRITE DMA EXT
  25 00 00 01 00 00 00 10 ce b7 80 e0 00     06:28:12.688  READ DMA EXT
  35 00 00 00 20 00 00 11 4d e6 a0 e0 00     06:28:12.688  WRITE DMA EXT
  25 00 00 00 20 00 00 12 6b 6a 40 e0 00     06:28:12.688  READ DMA EXT

Error 1342 [5] occurred at disk power-on lifetime: 28094 hours (1170 days + 14 hours)
  When the command that caused the error occurred, the device was active or idle.

  After command completion occurred, registers were:
  ER -- ST COUNT  LBA_48  LH LM LL DV DC
  -- -- -- == -- == == == -- -- -- -- --
  40 -- 51 00 08 00 00 0e 1a 00 08 e0 00  Error: UNC 8 sectors at LBA = 0x0e1a0008 = 236584968

  Commands leading to the command that caused the error were:
  CR FEATR COUNT  LBA_48  LH LM LL DV DC  Powered_Up_Time  Command/Feature_Name
  -- == -- == -- == == == -- -- -- -- --  ---------------  --------------------
  25 00 00 00 08 00 00 0e 1a 00 08 e0 00     05:52:02.813  READ DMA EXT
  35 00 00 00 20 00 00 0c 35 44 60 e0 00     05:52:01.125  WRITE DMA EXT
  25 00 00 00 08 00 00 0e 1a 00 00 e0 00     05:52:01.125  READ DMA EXT
  25 00 00 00 20 00 00 0c 35 44 60 e0 00     05:52:01.125  READ DMA EXT
  ec 00 00 00 00 00 00 00 00 00 00 a0 00     05:52:00.938  IDENTIFY DEVICE

Error 1341 [4] occurred at disk power-on lifetime: 28094 hours (1170 days + 14 hours)
  When the command that caused the error occurred, the device was active or idle.

  After command completion occurred, registers were:
  ER -- ST COUNT  LBA_48  LH LM LL DV DC
  -- -- -- == -- == == == -- -- -- -- --
  40 -- 51 00 20 00 00 0e 1a 00 00 e0 00  Error: UNC 32 sectors at LBA = 0x0e1a0000 = 236584960

  Commands leading to the command that caused the error were:
  CR FEATR COUNT  LBA_48  LH LM LL DV DC  Powered_Up_Time  Command/Feature_Name
  -- == -- == -- == == == -- -- -- -- --  ---------------  --------------------
  25 00 00 00 20 00 00 0e 1a 00 00 e0 00     05:52:00.875  READ DMA EXT
  35 00 00 00 20 00 00 10 ce b6 80 e0 00     05:51:59.125  WRITE DMA EXT
  25 00 00 00 20 00 00 0c 35 44 60 e0 00     05:51:59.125  READ DMA EXT
  35 00 00 00 08 00 00 11 00 86 98 e0 00     05:51:59.125  WRITE DMA EXT
  35 00 00 00 20 00 00 10 ce bc 20 e0 00     05:51:59.125  WRITE DMA EXT

SMART Extended Self-test Log (GP Log 0x07) not supported

SMART Self-test log structure revision number 1
Num  Test_Description    Status                  Remaining  LifeTime(hours)  LBA_of_first_error
# 1  Extended offline    Completed: read failure       50%     28022         236584968

SMART Selective self-test log data structure revision number 0
Note: revision number not 1 implies that no selective self-test has ever been run
 SPAN  MIN_LBA  MAX_LBA  CURRENT_TEST_STATUS
    1        0        0  Not_testing
    2        0        0  Not_testing
    3        0        0  Not_testing
    4        0        0  Not_testing
    5        0        0  Not_testing
Selective self-test flags (0x0):
  After scanning selected spans, do NOT read-scan remainder of disk.
If Selective self-test is pending on power-up, resume after 0 minute delay.

SCT Status Version:                  2
SCT Version (vendor specific):       256 (0x0100)
SCT Support Level:                   1
Device State:                        Active (0)
Current Temperature:                 33 Celsius
Power Cycle Max Temperature:         33 Celsius
Lifetime    Max Temperature:         52 Celsius

SCT Temperature History Version:     2
Temperature Sampling Period:         1 minute
Temperature Logging Interval:        1 minute
Min/Max recommended Temperature:     10/55 Celsius
Min/Max Temperature Limit:            5/60 Celsius
Temperature History Size (Index):    128 (86)

SCT Error Recovery Control:
           Read: Disabled
          Write: Disabled

Device Statistics (GP/SMART Log 0x04) not supported

SATA Phy Event Counters (GP Log 0x11)
ID      Size     Value  Description
0x0001  2            0  Command failed due to ICRC error
0x000a  2            0  Device-to-host register FISes sent due to a COMRESET
0x0008  2            0  Device-to-host non-data FIS retries
0x0009  2            0  Transition from drive PhyRdy to drive PhyNRdy
0x000b  2            0  CRC errors within host-to-device FIS
0x000d  2            0  Non-CRC errors within host-to-device FIS
0x8001  2            0  Vendor specific

