=== START OF INFORMATION SECTION ===
Model Family:     Seagate Samsung SpinPoint M8 (AF)
Device Model:     ST1000LM024 HN-M101MBB
Serial Number:    --
LU WWN Device Id: 5 0004cf ...
Firmware Version: 2AR10001
User Capacity:    1,000,204,886,016 bytes [1.00 TB]
Sector Sizes:     512 bytes logical, 4096 bytes physical
Rotation Rate:    5400 rpm
Form Factor:      2.5 inches
Device is:        In smartctl database [for details use: -P show]
ATA Version is:   ATA8-ACS T13/1699-D revision 6
SATA Version is:  SATA 3.0, 3.0 Gb/s (current: 3.0 Gb/s)
Local Time is:    Thu Sep  6 21:13:56 2018 MSK
SMART support is: Available - device has SMART capability.
SMART support is: Enabled
AAM feature is:   Unavailable
APM level is:     254 (maximum performance)
Rd look-ahead is: Enabled
Write cache is:   Enabled
DSN feature is:   Unavailable
ATA Security is:  Disabled, frozen [SEC2]
Wt Cache Reorder: Enabled

=== START OF READ SMART DATA SECTION ===
SMART overall-health self-assessment test result: PASSED

General SMART Values:
Offline data collection status:  (0x80)	Offline data collection activity
					was never started.
					Auto Offline Data Collection: Enabled.
Self-test execution status:      (   0)	The previous self-test routine completed
					without error or no self-test has ever 
					been run.
Total time to complete Offline 
data collection: 		(13440) seconds.
Offline data collection
capabilities: 			 (0x5b) SMART execute Offline immediate.
					Auto Offline data collection on/off support.
					Suspend Offline collection upon new
					command.
					Offline surface scan supported.
					Self-test supported.
					No Conveyance Self-test supported.
					Selective Self-test supported.
SMART capabilities:            (0x0003)	Saves SMART data before entering
					power-saving mode.
					Supports SMART auto save timer.
Error logging capability:        (0x01)	Error logging supported.
					General Purpose Logging supported.
Short self-test routine 
recommended polling time: 	 (   2) minutes.
Extended self-test routine
recommended polling time: 	 ( 224) minutes.
SCT capabilities: 	       (0x003f)	SCT Status supported.
					SCT Error Recovery Control supported.
					SCT Feature Control supported.
					SCT Data Table supported.

SMART Attributes Data Structure revision number: 16
Vendor Specific SMART Attributes with Thresholds:
ID# ATTRIBUTE_NAME          FLAGS    VALUE WORST THRESH FAIL RAW_VALUE
  1 Raw_Read_Error_Rate     POSR-K   100   100   051    -    7539
  2 Throughput_Performance  -OS--K   055   055   000    -    12364
  3 Spin_Up_Time            PO---K   089   089   025    -    3453
  4 Start_Stop_Count        -O--CK   094   094   000    -    6131
  5 Reallocated_Sector_Ct   PO--CK   252   252   010    -    0
  7 Seek_Error_Rate         -OSR-K   252   252   051    -    0
  8 Seek_Time_Performance   --S--K   252   252   015    -    0
  9 Power_On_Hours          -O--CK   100   100   000    -    19454
 10 Spin_Retry_Count        -O--CK   252   252   051    -    0
 11 Calibration_Retry_Count -O--CK   100   100   000    -    590
 12 Power_Cycle_Count       -O--CK   095   095   000    -    5907
191 G-Sense_Error_Rate      -O---K   100   100   000    -    212
192 Power-Off_Retract_Count -O---K   252   252   000    -    0
194 Temperature_Celsius     -O----   049   037   000    -    51 (Min/Max 6/63)
195 Hardware_ECC_Recovered  -O-RCK   100   100   000    -    0
196 Reallocated_Event_Count -O--CK   252   252   000    -    0
197 Current_Pending_Sector  -O--CK   252   100   000    -    0
198 Offline_Uncorrectable   ----CK   252   100   000    -    0
199 UDMA_CRC_Error_Count    -OS-CK   200   200   000    -    0
200 Multi_Zone_Error_Rate   -O-R-K   001   001   000    -    62822
223 Load_Retry_Count        -O--CK   100   100   000    -    590
225 Load_Cycle_Count        -O--CK   069   069   000    -    317811
                            ||||||_ K auto-keep
                            |||||__ C event count
                            ||||___ R error rate
                            |||____ S speed/performance
                            ||_____ O updated online
                            |______ P prefailure warning

General Purpose Log Directory Version 1
SMART           Log Directory Version 1 [multi-sector log support]
Address    Access  R/W   Size  Description
0x00       GPL,SL  R/O      1  Log Directory
0x01           SL  R/O      1  Summary SMART error log
0x02           SL  R/O      2  Comprehensive SMART error log
0x03       GPL     R/O      2  Ext. Comprehensive SMART error log
0x06           SL  R/O      1  SMART self-test log
0x07       GPL     R/O      2  Extended self-test log
0x08       GPL     R/O      2  Power Conditions log
0x09           SL  R/W      1  Selective self-test log
0x10       GPL     R/O      1  NCQ Command Error log
0x11       GPL     R/O      1  SATA Phy Event Counters log
0x80-0x9f  GPL,SL  R/W     16  Host vendor specific log
0xc0-0xdf  GPL,SL  VS      16  Device vendor specific log
0xe0       GPL,SL  R/W      1  SCT Command/Status
0xe1       GPL,SL  R/W      1  SCT Data Transfer

SMART Extended Comprehensive Error Log Version: 1 (2 sectors)
Device Error Count: 982 (device log contains only the most recent 8 errors)
	CR     = Command Register
	FEATR  = Features Register
	COUNT  = Count (was: Sector Count) Register
	LBA_48 = Upper bytes of LBA High/Mid/Low Registers ]  ATA-8
	LH     = LBA High (was: Cylinder High) Register    ]   LBA
	LM     = LBA Mid (was: Cylinder Low) Register      ] Register
	LL     = LBA Low (was: Sector Number) Register     ]
	DV     = Device (was: Device/Head) Register
	DC     = Device Control Register
	ER     = Error register
	ST     = Status register
Powered_Up_Time is measured from power on, and printed as
DDd+hh:mm:SS.sss where DD=days, hh=hours, mm=minutes,
SS=sec, and sss=millisec. It "wraps" after 49.710 days.

Error 982 [5] occurred at disk power-on lifetime: 19406 hours (808 days + 14 hours)
  When the command that caused the error occurred, the device was active or idle.

  After command completion occurred, registers were:
  ER -- ST COUNT  LBA_48  LH LM LL DV DC
  -- -- -- == -- == == == -- -- -- -- --
  40 -- 41 00 08 00 00 00 ab 85 48 40 00  Error: WP at LBA = 0x00ab8548 = 11240776

  Commands leading to the command that caused the error were:
  CR FEATR COUNT  LBA_48  LH LM LL DV DC  Powered_Up_Time  Command/Feature_Name
  -- == -- == -- == == == -- -- -- -- --  ---------------  --------------------
  61 00 00 01 00 00 00 04 b8 f9 c0 40 00     00:00:13.899  WRITE FPDMA QUEUED
  60 00 00 00 08 00 00 00 ab 85 48 40 00     00:00:13.898  READ FPDMA QUEUED
  60 00 00 00 08 00 00 00 ab 85 48 40 00     00:00:13.898  READ FPDMA QUEUED
  60 00 00 00 08 00 00 00 ab 85 40 40 00     00:00:13.898  READ FPDMA QUEUED
  60 00 00 00 08 00 00 00 ab 85 38 40 00     00:00:13.898  READ FPDMA QUEUED

Error 981 [4] occurred at disk power-on lifetime: 19385 hours (807 days + 17 hours)
  When the command that caused the error occurred, the device was in a vendor specific state.

  After command completion occurred, registers were:
  ER -- ST COUNT  LBA_48  LH LM LL DV DC
  -- -- -- == -- == == == -- -- -- -- --
  40 -- 41 01 00 00 00 00 e6 91 50 40 00  Error: UNC at LBA = 0x00e69150 = 15110480

  Commands leading to the command that caused the error were:
  CR FEATR COUNT  LBA_48  LH LM LL DV DC  Powered_Up_Time  Command/Feature_Name
  -- == -- == -- == == == -- -- -- -- --  ---------------  --------------------
  60 00 00 01 00 00 00 00 e6 91 50 40 00     00:00:12.400  READ FPDMA QUEUED
  60 00 90 01 00 00 00 00 e6 91 50 40 00     00:00:12.516  READ FPDMA QUEUED
  ef 00 90 00 03 00 00 00 00 00 00 a0 00     00:00:12.515  SET FEATURES [Disable SATA feature]
  ef 00 02 00 00 00 00 00 00 00 00 a0 00     00:00:12.515  SET FEATURES [Enable write cache]
  00 00 00 00 08 00 00 10 be b8 90 40 00     00:00:12.515  NOP [Abort queued commands]

Error 980 [3] occurred at disk power-on lifetime: 19385 hours (807 days + 17 hours)
  When the command that caused the error occurred, the device was in a vendor specific state.

  After command completion occurred, registers were:
  ER -- ST COUNT  LBA_48  LH LM LL DV DC
  -- -- -- == -- == == == -- -- -- -- --
  40 -- 41 01 00 00 00 00 e6 91 50 40 00  Error: UNC at LBA = 0x00e69150 = 15110480

  Commands leading to the command that caused the error were:
  CR FEATR COUNT  LBA_48  LH LM LL DV DC  Powered_Up_Time  Command/Feature_Name
  -- == -- == -- == == == -- -- -- -- --  ---------------  --------------------
  60 00 00 01 00 00 00 00 e6 91 50 40 00     00:00:12.400  READ FPDMA QUEUED
  60 00 90 01 00 00 00 00 e6 91 50 40 00     00:00:12.513  READ FPDMA QUEUED
  ef 00 90 00 03 00 00 00 00 00 00 a0 00     00:00:12.512  SET FEATURES [Disable SATA feature]
  ef 00 02 00 00 00 00 00 00 00 00 a0 00     00:00:12.512  SET FEATURES [Enable write cache]
  00 00 90 00 03 00 00 00 00 00 00 a0 00     00:00:12.512  NOP [Reserved subcommand] [OBS-ACS-2]

Error 979 [2] occurred at disk power-on lifetime: 19385 hours (807 days + 17 hours)
  When the command that caused the error occurred, the device was in a vendor specific state.

  After command completion occurred, registers were:
  ER -- ST COUNT  LBA_48  LH LM LL DV DC
  -- -- -- == -- == == == -- -- -- -- --
  40 -- 41 01 00 00 00 00 e6 91 50 40 00  Error: UNC at LBA = 0x00e69150 = 15110480

  Commands leading to the command that caused the error were:
  CR FEATR COUNT  LBA_48  LH LM LL DV DC  Powered_Up_Time  Command/Feature_Name
  -- == -- == -- == == == -- -- -- -- --  ---------------  --------------------
  60 00 02 01 00 00 00 00 e6 91 50 40 00     00:00:12.455  READ FPDMA QUEUED
  60 00 90 01 00 00 00 00 e6 91 50 40 00     00:00:12.510  READ FPDMA QUEUED
  60 00 90 00 80 00 00 01 04 c8 98 40 00     00:00:12.510  READ FPDMA QUEUED
  60 00 90 01 00 00 00 01 04 c7 98 40 00     00:00:12.510  READ FPDMA QUEUED
  60 00 90 00 80 00 00 00 e6 94 50 40 00     00:00:12.510  READ FPDMA QUEUED

Error 978 [1] occurred at disk power-on lifetime: 19385 hours (807 days + 17 hours)
  When the command that caused the error occurred, the device was in a vendor specific state.

  After command completion occurred, registers were:
  ER -- ST COUNT  LBA_48  LH LM LL DV DC
  -- -- -- == -- == == == -- -- -- -- --
  40 -- 41 01 00 00 00 00 e6 91 50 40 00  Error: UNC at LBA = 0x00e69150 = 15110480

  Commands leading to the command that caused the error were:
  CR FEATR COUNT  LBA_48  LH LM LL DV DC  Powered_Up_Time  Command/Feature_Name
  -- == -- == -- == == == -- -- -- -- --  ---------------  --------------------
  60 00 00 01 00 00 00 00 e6 91 50 40 00     00:00:12.449  READ FPDMA QUEUED
  60 00 90 01 00 00 00 00 e6 91 50 40 00     00:00:12.507  READ FPDMA QUEUED
  60 00 90 00 08 00 00 00 e6 90 d8 40 00     00:00:12.507  READ FPDMA QUEUED
  60 00 90 00 80 00 00 00 e6 90 d0 40 00     00:00:12.507  READ FPDMA QUEUED
  ef 00 90 00 03 00 00 00 00 00 00 a0 00     00:00:12.507  SET FEATURES [Disable SATA feature]

Error 977 [0] occurred at disk power-on lifetime: 19385 hours (807 days + 17 hours)
  When the command that caused the error occurred, the device was in a vendor specific state.

  After command completion occurred, registers were:
  ER -- ST COUNT  LBA_48  LH LM LL DV DC
  -- -- -- == -- == == == -- -- -- -- --
  40 -- 41 00 80 00 00 00 e6 90 d0 40 00  Error: UNC at LBA = 0x00e690d0 = 15110352

  Commands leading to the command that caused the error were:
  CR FEATR COUNT  LBA_48  LH LM LL DV DC  Powered_Up_Time  Command/Feature_Name
  -- == -- == -- == == == -- -- -- -- --  ---------------  --------------------
  60 00 90 00 80 00 00 00 e6 90 d0 40 00     00:00:12.447  READ FPDMA QUEUED
  60 00 90 00 80 00 00 00 e6 90 d0 40 00     00:00:12.504  READ FPDMA QUEUED
  60 00 90 00 08 00 00 00 e6 90 50 40 00     00:00:12.504  READ FPDMA QUEUED
  60 00 90 00 80 00 00 00 e6 90 50 40 00     00:00:12.504  READ FPDMA QUEUED
  60 00 90 00 08 00 00 00 e6 8f d0 40 00     00:00:12.504  READ FPDMA QUEUED

Error 976 [7] occurred at disk power-on lifetime: 19385 hours (807 days + 17 hours)
  When the command that caused the error occurred, the device was in a vendor specific state.

  After command completion occurred, registers were:
  ER -- ST COUNT  LBA_48  LH LM LL DV DC
  -- -- -- == -- == == == -- -- -- -- --
  40 -- 41 00 80 00 00 00 e6 90 d0 40 00  Error: UNC at LBA = 0x00e690d0 = 15110352

  Commands leading to the command that caused the error were:
  CR FEATR COUNT  LBA_48  LH LM LL DV DC  Powered_Up_Time  Command/Feature_Name
  -- == -- == -- == == == -- -- -- -- --  ---------------  --------------------
  60 00 00 01 00 00 00 00 e6 90 50 40 00     00:00:12.444  READ FPDMA QUEUED
  60 00 90 01 00 00 00 00 e6 90 50 40 00     00:00:12.502  READ FPDMA QUEUED
  ef 00 90 00 03 00 00 00 00 00 00 a0 00     00:00:12.501  SET FEATURES [Disable SATA feature]
  ef 00 02 00 00 00 00 00 00 00 00 a0 00     00:00:12.501  SET FEATURES [Enable write cache]
  00 00 00 01 00 00 00 10 c3 80 20 40 00     00:00:12.501  NOP [Abort queued commands]

Error 975 [6] occurred at disk power-on lifetime: 19385 hours (807 days + 17 hours)
  When the command that caused the error occurred, the device was in a vendor specific state.

  After command completion occurred, registers were:
  ER -- ST COUNT  LBA_48  LH LM LL DV DC
  -- -- -- == -- == == == -- -- -- -- --
  40 -- 41 00 80 00 00 00 e6 90 d0 40 00  Error: UNC at LBA = 0x00e690d0 = 15110352

  Commands leading to the command that caused the error were:
  CR FEATR COUNT  LBA_48  LH LM LL DV DC  Powered_Up_Time  Command/Feature_Name
  -- == -- == -- == == == -- -- -- -- --  ---------------  --------------------
  60 00 00 01 00 00 00 00 e6 90 50 40 00     00:00:12.443  READ FPDMA QUEUED
  60 00 90 01 00 00 00 00 e6 90 50 40 00     00:00:12.499  READ FPDMA QUEUED
  ef 00 90 00 03 00 00 00 00 00 00 a0 00     00:00:12.498  SET FEATURES [Disable SATA feature]
  ef 00 02 00 00 00 00 00 00 00 00 a0 00     00:00:12.498  SET FEATURES [Enable write cache]
  00 00 90 00 08 00 00 00 71 1f 58 40 00     00:00:12.498  NOP [Reserved subcommand] [OBS-ACS-2]

SMART Extended Self-test Log Version: 1 (2 sectors)
Num  Test_Description    Status                  Remaining  LifeTime(hours)  LBA_of_first_error
# 1  Vendor (0x50)       Completed without error       00%     19057         -
# 2  Short offline       Completed without error       00%     19057         -
# 3  Short offline       Completed: read failure       90%     19011         31277600
# 4  Vendor (0x50)       Completed without error       00%     19000         -
# 5  Short offline       Completed without error       00%     19000         -
# 6  Vendor (0x50)       Completed without error       00%     18296         -
# 7  Short offline       Completed without error       00%     18296         -
# 8  Vendor (0x50)       Completed without error       00%     18055         -
# 9  Short offline       Completed without error       00%     18055         -
#10  Short offline       Completed without error       00%     15383         -
#11  Extended offline    Aborted by host               90%     15383         -
#12  Extended offline    Aborted by host               90%     15295         -
#13  Extended offline    Aborted by host               90%     13656         -
#14  Extended offline    Aborted by host               50%     13589         -
#15  Vendor (0x50)       Completed without error       00%     13425         -
#16  Short offline       Completed without error       00%     13425         -
#17  Extended offline    Completed without error       00%     13220         -
#18  Extended offline    Completed without error       00%     13002         -
#19  Extended offline    Aborted by host               60%     12763         -
#20  Extended offline    Completed without error       00%     12679         -
#21  Vendor (0x50)       Completed without error       00%     11833         -

SMART Selective self-test log data structure revision number 0
Note: revision number not 1 implies that no selective self-test has ever been run
 SPAN  MIN_LBA  MAX_LBA  CURRENT_TEST_STATUS
    1        0        0  Completed [00% left] (0-65535)
    2        0        0  Not_testing
    3        0        0  Not_testing
    4        0        0  Not_testing
    5        0        0  Not_testing
Selective self-test flags (0x0):
  After scanning selected spans, do NOT read-scan remainder of disk.
If Selective self-test is pending on power-up, resume after 0 minute delay.

SCT Status Version:                  2
SCT Version (vendor specific):       256 (0x0100)
SCT Support Level:                   1
Device State:                        Active (0)
Current Temperature:                    51 Celsius
Power Cycle Min/Max Temperature:     50/53 Celsius
Lifetime    Min/Max Temperature:      7/63 Celsius
Under/Over Temperature Limit Count:   0/0

SCT Temperature History Version:     2
Temperature Sampling Period:         5 minutes
Temperature Logging Interval:        5 minutes
Min/Max recommended Temperature:     -5/80 Celsius
Min/Max Temperature Limit:           -10/85 Celsius
Temperature History Size (Index):    128 (87)

SCT Error Recovery Control:
           Read: Disabled
          Write: Disabled

Device Statistics (GP/SMART Log 0x04) not supported

Pending Defects log (GP Log 0x0c) not supported

SATA Phy Event Counters (GP Log 0x11)
ID      Size     Value  Description
0x0001  4            0  Command failed due to ICRC error
0x0002  4            0  R_ERR response for data FIS
0x0003  4            0  R_ERR response for device-to-host data FIS
0x0004  4            0  R_ERR response for host-to-device data FIS
0x0005  4            0  R_ERR response for non-data FIS
0x0006  4            0  R_ERR response for device-to-host non-data FIS
0x0007  4            0  R_ERR response for host-to-device non-data FIS
0x0008  4            0  Device-to-host non-data FIS retries
0x0009  4        10181  Transition from drive PhyRdy to drive PhyNRdy
0x000a  4           57  Device-to-host register FISes sent due to a COMRESET
0x000b  4            0  CRC errors within host-to-device FIS
0x000d  4            0  Non-CRC errors within host-to-device FIS
0x000f  4            0  R_ERR response for host-to-device data FIS, CRC
0x0010  4            0  R_ERR response for host-to-device data FIS, non-CRC
0x0012  4            0  R_ERR response for host-to-device non-data FIS, CRC
0x0013  4            0  R_ERR response for host-to-device non-data FIS, non-CRC
0x8e00  4            0  Vendor specific
0x8e01  4            0  Vendor specific
0x8e02  4            0  Vendor specific
0x8e03  4            0  Vendor specific
0x8e04  4            0  Vendor specific
0x8e05  4            0  Vendor specific
0x8e06  4            0  Vendor specific
0x8e07  4            0  Vendor specific
0x8e08  4            0  Vendor specific
0x8e09  4            0  Vendor specific
0x8e0a  4            0  Vendor specific
0x8e0b  4            0  Vendor specific
0x8e0c  4            0  Vendor specific
0x8e0d  4            0  Vendor specific
0x8e0e  4            0  Vendor specific
0x8e0f  4            0  Vendor specific
0x8e10  4            0  Vendor specific
0x8e11  4            0  Vendor specific

